{
  "contractVersion": "us-runtime-stages-v2",
  "edges": [
    {
      "id": "01_run_profile__02_source_loading",
      "label": "provider_query_plan",
      "resourceKeys": [
        "provider_query_plan"
      ],
      "source": "01_run_profile",
      "target": "02_source_loading",
      "viewer": {
        "edgeKind": "stage_handoff",
        "routing": "elk_orthogonal"
      }
    },
    {
      "id": "02_source_loading__03_source_planning",
      "label": "stage handoff",
      "resourceKeys": [],
      "source": "02_source_loading",
      "target": "03_source_planning",
      "viewer": {
        "edgeKind": "stage_handoff",
        "routing": "elk_orthogonal"
      }
    },
    {
      "id": "03_source_planning__04_seed_scaffold",
      "label": "source_plan, scaffold_selection",
      "resourceKeys": [
        "source_plan",
        "scaffold_selection"
      ],
      "source": "03_source_planning",
      "target": "04_seed_scaffold",
      "viewer": {
        "edgeKind": "stage_handoff",
        "routing": "elk_orthogonal"
      }
    },
    {
      "id": "04_seed_scaffold__05_donor_integration_synthesis",
      "label": "scaffold_seed_data",
      "resourceKeys": [
        "scaffold_seed_data"
      ],
      "source": "04_seed_scaffold",
      "target": "05_donor_integration_synthesis",
      "viewer": {
        "edgeKind": "stage_handoff",
        "routing": "elk_orthogonal"
      }
    },
    {
      "id": "05_donor_integration_synthesis__06_policyengine_entities",
      "label": "synthetic_data",
      "resourceKeys": [
        "synthetic_data"
      ],
      "source": "05_donor_integration_synthesis",
      "target": "06_policyengine_entities",
      "viewer": {
        "edgeKind": "stage_handoff",
        "routing": "elk_orthogonal"
      }
    },
    {
      "id": "06_policyengine_entities__07_calibration",
      "label": "pre_calibration_policyengine_entity_tables",
      "resourceKeys": [
        "pre_calibration_policyengine_entity_tables"
      ],
      "source": "06_policyengine_entities",
      "target": "07_calibration",
      "viewer": {
        "edgeKind": "stage_handoff",
        "routing": "elk_orthogonal"
      }
    },
    {
      "id": "07_calibration__08_dataset_assembly",
      "label": "calibrated_data, policyengine_entity_tables",
      "resourceKeys": [
        "calibrated_data",
        "policyengine_entity_tables"
      ],
      "source": "07_calibration",
      "target": "08_dataset_assembly",
      "viewer": {
        "edgeKind": "stage_handoff",
        "routing": "elk_orthogonal"
      }
    },
    {
      "id": "08_dataset_assembly__09_validation_benchmarking",
      "label": "policyengine_dataset",
      "resourceKeys": [
        "policyengine_dataset"
      ],
      "source": "08_dataset_assembly",
      "target": "09_validation_benchmarking",
      "viewer": {
        "edgeKind": "stage_handoff",
        "routing": "elk_orthogonal"
      }
    }
  ],
  "generatedFrom": "microplex_us.pipelines.stage_contracts",
  "nodes": [
    {
      "artifacts": [
        {
          "description": "Top-level artifact manifest with resolved config.",
          "format": "json",
          "hash_mode": "file_sha256",
          "key": "manifest",
          "path_hint": "manifest.json",
          "required": true,
          "resume_role": null
        }
      ],
      "consumes": [
        "user configuration",
        "provider defaults",
        "runtime overrides"
      ],
      "diagnostics": [
        "resolved provider names",
        "sample/query filters",
        "target period",
        "baseline dataset and target DB references"
      ],
      "id": "01_run_profile",
      "inputs": [
        {
          "artifact_key": null,
          "config_key": "profile",
          "description": "Selected build profile and runtime overrides.",
          "key": "build_profile",
          "kind": "config",
          "manifest_key": null,
          "required": false,
          "stage_id": null
        },
        {
          "artifact_key": null,
          "config_key": "policyengine_target_period",
          "description": "Target period used by downstream PolicyEngine export and validation.",
          "key": "policyengine_target_period",
          "kind": "config",
          "manifest_key": null,
          "required": true,
          "stage_id": null
        },
        {
          "artifact_key": null,
          "config_key": "calibration_backend",
          "description": "Calibration backend selected for this run.",
          "key": "calibration_backend",
          "kind": "config",
          "manifest_key": null,
          "required": true,
          "stage_id": null
        },
        {
          "artifact_key": null,
          "config_key": "source_names",
          "description": "Requested source names or provider defaults.",
          "key": "source_names",
          "kind": "config",
          "manifest_key": null,
          "required": false,
          "stage_id": null
        }
      ],
      "order": 0,
      "outputs": [
        {
          "artifact_key": "manifest",
          "config_key": null,
          "description": "Top-level manifest containing resolved configuration and artifact map.",
          "key": "manifest",
          "kind": "artifact",
          "manifest_key": null,
          "required": true,
          "stage_id": "01_run_profile"
        },
        {
          "artifact_key": null,
          "config_key": null,
          "description": "Resolved build configuration recorded for downstream stages.",
          "key": "resolved_config",
          "kind": "stage_output",
          "manifest_key": null,
          "required": true,
          "stage_id": "01_run_profile"
        },
        {
          "artifact_key": null,
          "config_key": null,
          "description": "Resolved provider and source-query plan for source loading.",
          "key": "provider_query_plan",
          "kind": "stage_output",
          "manifest_key": null,
          "required": true,
          "stage_id": "01_run_profile"
        }
      ],
      "produces": [
        "resolved build config",
        "provider/query plan"
      ],
      "purpose": "Resolve the build profile, runtime config, providers, queries, and run-level options.",
      "resume": {
        "mode": "metadata_only",
        "notes": "The resolved config can be reused, but this stage does not contain reloadable data by itself."
      },
      "step": "01",
      "title": "Run profile, config, and source bundle",
      "validations": [
        {
          "description": "Check required paths and context for the selected profile.",
          "key": "config_context",
          "status": "planned"
        }
      ],
      "viewer": {
        "elkPartition": 0,
        "nodeKind": "configuration",
        "type": "stage"
      }
    },
    {
      "artifacts": [],
      "consumes": [
        "resolved provider/query plan",
        "source manifests",
        "external datasets"
      ],
      "diagnostics": [
        "source row counts",
        "entity coverage",
        "relationship validity",
        "cache/download provenance"
      ],
      "id": "02_source_loading",
      "inputs": [
        {
          "artifact_key": null,
          "config_key": null,
          "description": "Resolved provider and source-query plan from Stage 1.",
          "key": "provider_query_plan",
          "kind": "stage_output",
          "manifest_key": null,
          "required": true,
          "stage_id": "01_run_profile"
        },
        {
          "artifact_key": null,
          "config_key": null,
          "description": "External source datasets requested by the provider/query plan.",
          "key": "source_datasets",
          "kind": "external_data",
          "manifest_key": null,
          "required": true,
          "stage_id": null
        }
      ],
      "order": 1,
      "outputs": [
        {
          "artifact_key": null,
          "config_key": null,
          "description": "Saved summary of loaded Microplex observation frames with source metadata.",
          "key": "observation_frame_summary",
          "kind": "stage_output",
          "manifest_key": null,
          "required": true,
          "stage_id": "02_source_loading"
        },
        {
          "artifact_key": null,
          "config_key": null,
          "description": "Source descriptors attached to the loaded observation frames.",
          "key": "source_descriptors",
          "kind": "stage_output",
          "manifest_key": null,
          "required": true,
          "stage_id": "02_source_loading"
        },
        {
          "artifact_key": null,
          "config_key": null,
          "description": "Validated entity relationships in loaded source frames.",
          "key": "source_relationships",
          "kind": "stage_output",
          "manifest_key": null,
          "required": true,
          "stage_id": "02_source_loading"
        }
      ],
      "produces": [
        "observation frames",
        "source descriptors",
        "entity relationships"
      ],
      "purpose": "Load external datasets into validated Microplex observation frames.",
      "resume": {
        "mode": "none",
        "notes": "Full source-frame snapshotting is not implemented yet."
      },
      "step": "02",
      "title": "Source contracts and source loading",
      "validations": [
        {
          "description": "Validate required entity tables and relationships for each source.",
          "key": "observation_frame_validity",
          "status": "planned"
        }
      ],
      "viewer": {
        "elkPartition": 1,
        "nodeKind": "source",
        "type": "stage"
      }
    },
    {
      "artifacts": [
        {
          "description": "Compact JSON summary of source names, scaffold, and donor variable plan.",
          "format": "json",
          "hash_mode": "file_sha256",
          "key": "source_plan",